<?xml version='1.0' encoding='UTF-8' ?>

<addon id='Hangman' xmlns="http://icplayer.com" xmlns:xsi="http://www.w3.org/2001/XMLSchema-instance" xsi:schemaLocation="http://icplayer.com ../../tools/addon.xsd">
	<model>
		<property name="Phrases" nameLabel="Hangman_property_phrases" type="list">
			<property name="Letters" nameLabel="Hangman_property_letters" type="string" isLocalized="true" />
			<property name="Phrase" nameLabel="Hangman_property_phrase" type="string" isLocalized="true" />
		</property>
		<property name="Possible mistakes" nameLabel="Hangman_property_possible_mistakes" type="string" />
        <property name="isNotActivity" displayName="Is Not Activity" nameLabel="Hangman_property_is_not_activity" type="boolean" />
        <property name="Keyboard Letters Order" displayName="Keyboard Letters Order" nameLabel="Hangman_property_keyboard_letters_order" type="string" />
	</model>
</addon>